{
  "headline_angle": "하이퍼스케일 ASIC 전환으로 NVIDIA 중심 GPU 가치사슬이 해체되고 자본이 공급망 핵심기업으로 이동한다",
  "key_message": "하이퍼스케일러들의 목적 설계 ASIC 도입은 비용·전력 효율을 극대화하며 GPU 독주 체제를 무너뜨리고, 설계·인터커넥트·전력·패키징 공급망 기업으로 자본과 수익 흐름을 재편한다.",
  "summary": "Amazon의 Trainium3 출시는 AI 인프라 시장에서 NVIDIA의 독주 구도에 균열을 내며, 하이퍼스케일러들의 맞춤형 ASIC 도입이 급격히 증가하고 있다. 이 변화는 단순한 가속기 경쟁을 넘어 설계·IP, 인터커넥트, 전력 관리, 패키징 등 공급망 핵심 분야로 자본과 수익이 이동하는 구조적 전환을 예고한다. Project Rainier 등 대규모 ASIC 배포는 해당 생태계 기업들의 반복적 매출 증가를 일으키며, 투자 전략의 포커스 역시 ASIC 설계와 공급망 관련 기업으로 전환이 요구된다.",
  "summary_sns_short": "GPU 시대 끝, 자본이 ASIC 설계와 공급망 ‘그림자 승자’에게 몰린다.",
  "summary_sns_post": "AWS Trainium3와 같은 하이퍼스케일 ASIC 출현은 NVIDIA 중심의 GPU 독점 질서를 깨뜨리며, AI 인프라 시장의 구조적 전환을 가속화한다. 단순 칩 경쟁을 넘어 자본과 수익이 설계·IP, 고속 인터커넥트, 전력 관리, 패키징 등 공급망 핵심기업으로 이동하는 현상이 벌어지고 있다. 대부분 투자자의 시선은 여전히 가속기 프론트라인에 머물러 있지만, 진짜 돈과 성장 기회는 그림자 속 ‘반복 매출 생태계’로 재편되는 핵심 공급망에 숨어있다. 지금이야말로 ASIC 블루프린트와 생태계 기업들을 주목해야 할 때다.",
  "hooks": [
    "하이퍼스케일러 ASIC 도입이 자본 흐름의 무게중심을 어떻게 바꾸는가?",
    "GPU 독주가 끝나며 진짜 승자가 공급망 핵심 기업인 이유는?",
    "Project Rainier는 무엇을 보여주는 실증적 신호인가?",
    "왜 앞으로 투자자는 가속기보다 ASIC 생태계 기업에 주목해야 하는가?",
    "CXL과 실리콘 포토닉스는 시장 전환의 속도와 리스크를 어떻게 좌우하나?"
  ],
  "one_line_takeaway": "앞으로 AI 인프라 투자에서 가속기 자체보다 ASIC 설계·인터커넥트·전력·패키징 공급망 핵심 기업들을 중심에 두어야 반복 가능하고 예측 가능한 수익 기회를 잡을 수 있다."
}
